{
  "store_id": "7a39e99a-df52-49e0-8a9a-bb5ae3b29f2e",
  "enseigne": "Super U",
  "store_name": "Super U Wormhout",
  "last_updated": "2025-08-14T14:24:32.015Z",
  "goal": "hybride",
  "axes": {
    "adresse_contexte": {
      "adresse_postale": {
        "value": "747 Rue de Bergues, 59470 Wormhout",
        "sources": [
          {
            "type": "open_web",
            "name": "Site enseigne",
            "url": "https://www.magasins-u.com/magasin/superu-wormhout.m21813",
            "collected_at": "2025-08-14T14:24:32.015Z"
          }
        ]
      },
      "coordonnees": {
        "latitude": {
          "value": 50.89131881620447,
          "sources": [
            {
              "type": "open_web",
              "name": "Site enseigne",
              "url": "https://www.magasins-u.com/magasin/superu-wormhout.m21813",
              "collected_at": "2025-08-14T14:24:32.015Z"
            }
          ]
        },
        "longitude": {
          "value": 2.461808040344758,
          "sources": [
            {
              "type": "open_web",
              "name": "Site enseigne",
              "url": "https://www.magasins-u.com/magasin/superu-wormhout.m21813",
              "collected_at": "2025-08-14T14:24:32.015Z"
            }
          ]
        }
      },
      "references_ouvertes": [
        {
          "page_type": "page_magasin_enseigne",
          "title": "Super U Wormhout â€” Super U",
          "language": "fr",
          "url": "https://www.magasins-u.com/magasin/superu-wormhout.m21813",
          "source": {
            "type": "open_web",
            "name": "Site enseigne",
            "url": "https://www.magasins-u.com/magasin/superu-wormhout.m21813",
            "collected_at": "2025-08-14T14:24:32.015Z"
          },
          "collected_at": "2025-08-14T14:24:32.015Z"
        }
      ]
    }
  }
}