{
  "store_id": "4a1b0ad6-968e-4606-a7fe-e541d9b6b01c",
  "enseigne": "Super U",
  "store_name": "Super U et Drive",
  "last_updated": "2025-08-19T06:44:24.801Z",
  "goal": "hybride",
  "axes": {
    "adresse_contexte": {
      "adresse_postale": {
        "value": "747 Rue de Bergues, 59470 Wormhout",
        "sources": [
          {
            "type": "open_web",
            "name": "Site enseigne",
            "url": "https://www.coursesu.com/f-superu-wormhout-informations",
            "collected_at": "2025-08-19T06:44:24.797Z"
          }
        ]
      },
      "coordonnees": {
        "latitude": {
          "value": 50.89124440000001,
          "sources": [
            {
              "type": "open_web",
              "name": "Site enseigne",
              "url": "https://www.coursesu.com/f-superu-wormhout-informations",
              "collected_at": "2025-08-19T06:44:24.797Z"
            }
          ]
        },
        "longitude": {
          "value": 2.4618295,
          "sources": [
            {
              "type": "open_web",
              "name": "Site enseigne",
              "url": "https://www.coursesu.com/f-superu-wormhout-informations",
              "collected_at": "2025-08-19T06:44:24.797Z"
            }
          ]
        }
      },
      "references_ouvertes": [
        {
          "page_type": "page_magasin_enseigne",
          "title": "Super U et Drive â€” Super U",
          "language": "fr",
          "url": "https://www.coursesu.com/f-superu-wormhout-informations",
          "source": {
            "type": "open_web",
            "name": "Site enseigne",
            "url": "https://www.coursesu.com/f-superu-wormhout-informations",
            "collected_at": "2025-08-19T06:44:24.797Z"
          },
          "collected_at": "2025-08-19T06:44:24.801Z"
        }
      ]
    }
  }
}